{
  "schemaVersion": 1,
  "id": "wizard.health-globe",
  "slug": "health_globe",
  "title": "Health Globe v1",
  "description": "Earlier canvas health-globe demo, retained for reference.",
  "status": "legacy",
  "visibility": "legacy",
  "category": "reference",
  "group": "legacy",
  "launch": "tools/health_globe/index.html",
  "readme": "docs/ARCHIVE.md",
  "preview": null,
  "moduleVersion": "1.0.0",
  "stateVersion": 1,
  "verdigrisTargets": ["hud-resources"],
  "capabilities": {
    "adapter": false,
    "scenarios": false,
    "stateExport": false,
    "stateImport": false,
    "snapshots": false,
    "annotations": false,
    "proposals": false,
    "fixtures": false,
    "events": false,
    "pauseStep": false,
    "agentFeedback": false
  },
  "unsupportedMethods": ["reset", "getState", "setState", "listScenarios", "loadScenario", "pause", "resume", "step", "getMetrics", "getAnnotations", "setAnnotations", "exportCalibration", "importCalibration"],
  "tags": ["legacy", "canvas", "reference"]
}
