{
  "schemaVersion": 1,
  "id": "wizard.verdigris-splash",
  "slug": "verdigris_splash",
  "title": "World Presentation",
  "description": "Preview the disc world, switch views, and adjust rendering quality.",
  "status": "presentation",
  "visibility": "dashboard",
  "category": "presentation",
  "group": "world-terrain",
  "launch": "tools/verdigris_splash/index.html",
  "readme": "tools/verdigris_splash/README.md",
  "preview": null,
  "moduleVersion": "2.6.0",
  "stateVersion": 1,
  "verdigrisTargets": ["world-presentation"],
  "capabilities": {
    "adapter": false,
    "scenarios": false,
    "stateExport": false,
    "stateImport": false,
    "snapshots": false,
    "annotations": false,
    "proposals": false,
    "fixtures": false,
    "events": false,
    "pauseStep": false,
    "agentFeedback": false
  },
  "unsupportedMethods": ["listScenarios", "loadScenario", "getAnnotations", "setAnnotations", "pause", "resume", "step", "getState", "setState"],
  "tags": ["presentation", "threejs", "world"]
}
