{
  "schemaVersion": 1,
  "id": "wizard.systems-bench",
  "slug": "systems_bench",
  "title": "Systems Bench",
  "description": "Replay recorded events, inspect payloads, and preview module state through the shared adapter.",
  "status": "prototype",
  "visibility": "dashboard",
  "category": "integration",
  "group": "systems-integration",
  "launch": "tools/systems_bench/index.html",
  "readme": "tools/systems_bench/README.md",
  "preview": null,
  "moduleVersion": "0.1.0",
  "stateVersion": 1,
  "verdigrisTargets": ["systems-integration", "hud-resources"],
  "capabilities": {
    "adapter": true,
    "scenarios": true,
    "stateExport": true,
    "stateImport": true,
    "snapshots": true,
    "annotations": false,
    "proposals": false,
    "fixtures": true,
    "events": true,
    "pauseStep": true,
    "agentFeedback": true
  },
  "unsupportedMethods": ["getAnnotations", "setAnnotations"],
  "tags": ["integration", "fixtures", "events"]
}
