{
  "schemaVersion": 1,
  "id": "wizard.cartographer",
  "slug": "cartographer",
  "title": "Cartographer",
  "description": "Compose natural terrain, cathedral spines, oriented crypts and island circuits with readable doorways, exploration frontiers and validated map exports.",
  "status": "authoring",
  "visibility": "dashboard",
  "category": "authoring",
  "group": "world-terrain",
  "launch": "tools/cartographer/index.html",
  "readme": "tools/cartographer/README.md",
  "preview": null,
  "moduleVersion": "4.0.0",
  "stateVersion": 1,
  "verdigrisTargets": [
    "zone-generation"
  ],
  "capabilities": {
    "adapter": false,
    "scenarios": false,
    "stateExport": false,
    "stateImport": false,
    "snapshots": false,
    "annotations": false,
    "proposals": false,
    "fixtures": false,
    "events": false,
    "pauseStep": false,
    "agentFeedback": false
  },
  "unsupportedMethods": [
    "listScenarios",
    "loadScenario",
    "getAnnotations",
    "setAnnotations",
    "pause",
    "resume",
    "step"
  ],
  "tags": [
    "procgen",
    "zones",
    "canvas",
    "expeditions",
    "map-reading"
  ]
}
