{
  "schemaVersion": 1,
  "id": "wizard.geometric-skilltree",
  "slug": "geometric_skilltree",
  "title": "Geometric Passive Tree",
  "description": "Edit passive nodes and conduits, inspect pattern bonuses, and export builds and design notes.",
  "status": "authoring",
  "visibility": "dashboard",
  "category": "authoring",
  "group": "character-systems",
  "launch": "tools/geometric_skilltree/index.html",
  "readme": "tools/geometric_skilltree/README.md",
  "preview": null,
  "moduleVersion": "1.0.0",
  "stateVersion": 1,
  "verdigrisTargets": ["passive-tree"],
  "capabilities": {
    "adapter": true,
    "scenarios": true,
    "stateExport": true,
    "stateImport": true,
    "snapshots": true,
    "annotations": true,
    "proposals": true,
    "fixtures": false,
    "events": false,
    "pauseStep": false,
    "agentFeedback": true
  },
  "unsupportedMethods": ["pause", "resume", "step"],
  "tags": ["passive-tree", "svg", "authoring"]
}
