{
  "schemaVersion": 1,
  "id": "wizard.chronicles",
  "slug": "rp_account_creator",
  "title": "House Creator",
  "description": "Create houses and characters, simulate permadeath, and track inherited relics.",
  "status": "authoring",
  "visibility": "dashboard",
  "category": "authoring",
  "group": "chronicles",
  "launch": "tools/rp_account_creator/index.html",
  "readme": "tools/rp_account_creator/README.md",
  "preview": null,
  "moduleVersion": "1.0.0",
  "stateVersion": 1,
  "verdigrisTargets": ["chronicle-meta"],
  "capabilities": {
    "adapter": false,
    "scenarios": false,
    "stateExport": false,
    "stateImport": false,
    "snapshots": false,
    "annotations": false,
    "proposals": false,
    "fixtures": false,
    "events": false,
    "pauseStep": false,
    "agentFeedback": false
  },
  "unsupportedMethods": ["listScenarios", "loadScenario", "getAnnotations", "setAnnotations", "pause", "resume", "step"],
  "tags": ["chronicles", "houses", "permadeath"]
}
