{
  "schemaVersion": 1,
  "id": "wizard.framepack-gallery",
  "slug": "framepack_gallery",
  "title": "Framepack Validation Gallery",
  "description": "Internal manifest-driven bench for validating framepack dimensions, alpha, checksums, slice bounds, state assets, and multi-size nine-slice previews.",
  "status": "internal",
  "visibility": "internal",
  "category": "integration",
  "group": "internal",
  "launch": "tools/framepack_gallery/index.html",
  "readme": "tools/framepack_gallery/README.md",
  "preview": null,
  "moduleVersion": "1.0.0",
  "stateVersion": 1,
  "verdigrisTargets": ["systems-integration"],
  "capabilities": {
    "adapter": false,
    "scenarios": false,
    "stateExport": false,
    "stateImport": false,
    "snapshots": false,
    "annotations": false,
    "proposals": false,
    "fixtures": true,
    "events": false,
    "pauseStep": false,
    "agentFeedback": false
  },
  "unsupportedMethods": [
    "reset",
    "getState",
    "setState",
    "listScenarios",
    "loadScenario",
    "pause",
    "resume",
    "step",
    "getMetrics",
    "getAnnotations",
    "setAnnotations",
    "exportCalibration",
    "importCalibration"
  ],
  "tags": ["internal", "framepack", "nine-slice", "validation"]
}
