{
  "schemaVersion": 1,
  "id": "wizard.mason",
  "slug": "mason",
  "title": "Mason — Terrain Tiles",
  "description": "Generate square and hex terrain transition tiles, preview them, and export tile sets.",
  "status": "authoring",
  "visibility": "internal",
  "category": "authoring",
  "group": "world-terrain",
  "launch": "tools/mason/index.html",
  "readme": "tools/mason/README.md",
  "preview": null,
  "moduleVersion": "1.0.0",
  "stateVersion": 1,
  "verdigrisTargets": ["terrain-autotile"],
  "capabilities": {
    "adapter": false,
    "scenarios": false,
    "stateExport": false,
    "stateImport": false,
    "snapshots": false,
    "annotations": false,
    "proposals": false,
    "fixtures": false,
    "events": false,
    "pauseStep": false,
    "agentFeedback": false
  },
  "unsupportedMethods": ["listScenarios", "loadScenario", "getAnnotations", "setAnnotations", "pause", "resume", "step"],
  "tags": ["autotile", "terrain", "canvas"]
}
